{"artifact_type":"result","baseline_ref":null,"case_ref":{"digest":"sha256:0865f62bc656529eb5b1bac1bae1673b67a4ffa035c0a90d26745b8968543416","id":"m0.barrier-atomicity","version":1},"content_digest":"sha256:64e99164087da051b6bff93b11a4dcd4d358584ddfd96918072b35577f086839","cost":{"input_tokens":0,"output_tokens":0,"total_microusd":0},"decision":"insufficient_evidence","decision_authority":{"id":"tamoz.m0.gate","kind":"deterministic_gate","version":"v1"},"digest_version":1,"environment":{"platform":"not-executed","profile":"pr","ruby_version":"not-executed"},"format_version":1,"hard_gates":[{"evidence_ids":["m0.baseline-summary"],"id":"runtime-implemented","status":"unknown"}],"invalid_evidence":[],"references":[{"classification":"public","digest":"sha256:73a3e046f81828a7c6608e24edb4ebfc11ba50f9db17c232f2ca40631b4f86be","id":"m0.baseline-summary","kind":"summary","path":"evidence/baseline-summary.json"}],"result_id":"tamoz.m0.baseline","scores":[],"status":"insufficient_evidence","subject":{"behavior_version":"m0.no-runtime","digest":"sha256:a651631a685eb744a34078f6ca694b1c0dd0059ec2f0ede9586d1846b83d6359","git_revision":"0000000","id":"tamoz-agent","version":"0.1.0.alpha.1"},"suite_ref":{"digest":"sha256:5fa17fe91618dc798ab10045b385672495387f9ffc0ab3c0adec50b7f4aa9016","id":"tamoz.m0.golden","version":1},"timing":{"duration_ms":0,"finished_at":"2026-07-30T00:00:00Z","started_at":"2026-07-30T00:00:00Z"}}
